{
  "schema_version": 1,
  "record_type": "proposal-context",
  "investigation_id": "investigation",
  "investigation_sha256": "1111111111111111111111111111111111111111111111111111111111111111",
  "baseline_sha256": "2222222222222222222222222222222222222222222222222222222222222222",
  "source": {
    "workspace_sha256": "3333333333333333333333333333333333333333333333333333333333333333",
    "capture_operation_id": "capture",
    "capture_sha256": "4444444444444444444444444444444444444444444444444444444444444444"
  }
}
